Top queries,Clicks,Impressions,CTR,Position
divorce coach certification,2,387,0.52%,55.82
how to become a certified divorce coach,1,14,7.14%,45.14
divorce coach course,1,8,12.5%,60.5
best divorce coach certification,1,7,14.29%,61.29
certified divorce coach,0,1375,0%,45.63
divorce statistics uk,0,384,0%,73.55
how to become a divorce coach,0,292,0%,61.68
divorce advice for men,0,274,0%,87.98
divorce rate uk,0,233,0%,78.97
divorce coaching,0,197,0%,94.04
certified divorce coach near london,0,193,0%,78.88
uk divorce rate,0,161,0%,78.55
divorce coaching certification,0,157,0%,56.1
divorce rates uk,0,157,0%,79.58
the divorce coach,0,151,0%,92.43
divorce rate in uk,0,141,0%,77.74
divorce uk statistics,0,141,0%,84.69
divorce coach,0,130,0%,96.6
uk divorce statistics,0,124,0%,87.27
what is a certified divorce coach,0,114,0%,49.88
certified divorce coach in london,0,107,0%,78.74
certified divorce coach cost in london,0,97,0%,66.09
online breakup support group,0,80,0%,62.15
percentage of divorce in uk,0,80,0%,87.86
divorce tips for men,0,76,0%,81.01
divorce coaching course,0,76,0%,91.79
divorce percentage uk,0,75,0%,83.05
coaching divorce,0,74,0%,81.12
divorce rate uk 2023,0,67,0%,81.57
divorce statistics in uk,0,64,0%,80.05
rate of divorce uk,0,62,0%,81.52
divorce rate in america,0,53,0%,80.21
divorce coach certification online,0,52,0%,56.38
breakup support groups,0,52,0%,59.38
uk divorce rates,0,50,0%,78.24
uk divorce rate 2023,0,49,0%,93.33
divorce rates in the us over time,0,48,0%,86.21
divorce rate in us,0,47,0%,84.62
divorce percentage in uk,0,47,0%,87
us divorce rate by year,0,46,0%,92.74
us divorce rate,0,40,0%,83.15
become a divorce coach,0,39,0%,50.95
divorce coach training,0,39,0%,62.1
certified divorce coaching,0,38,0%,87.42
breakup coach certification,0,37,0%,11.11
divorce rates in uk,0,37,0%,85.65
statistics on divorce uk,0,32,0%,88.53
divorce coach uk,0,32,0%,96.22
divorce rate in england,0,31,0%,76.55
average divorce rate uk,0,31,0%,88.65
divorce rate in the uk,0,30,0%,81.37
average divorce age uk,0,29,0%,82
statistics of divorce uk,0,28,0%,89.11
divorce rates uk 2023,0,28,0%,92.54
united kingdom divorce rate,0,26,0%,75.88
divorce rate in uk 2023,0,26,0%,94.85
what is the divorce rate in the uk,0,25,0%,83
uk divorce rate by year,0,25,0%,91
current divorce rate uk,0,25,0%,97.56
divorcecoach,0,25,0%,97.76
divorce rate england,0,24,0%,80.42
sara davison divorce coach,0,23,0%,46.43
divorce rate in the united states,0,22,0%,84.77
divorce rate in britain,0,21,0%,88.52
divorce rate in usa,0,21,0%,89.95
certified divorce coach cost,0,20,0%,22.9
average age of divorce uk,0,20,0%,70.05
british divorce rate,0,20,0%,80.5
what is the current divorce rate in the uk,0,20,0%,97.1
support groups for breakups,0,19,0%,60.42
us divorce rates by year,0,19,0%,94.79
coach en divorce,0,18,0%,82.33
what is the divorce rate in the us,0,18,0%,90.67
breakup support group,0,17,0%,61.47
divorce stats uk,0,17,0%,79.71
divorce rates by decade,0,17,0%,83.12
england divorce rate,0,16,0%,79.5
divorce rate in america over time,0,16,0%,89.69
britain divorce rate,0,15,0%,76.27
what is divorce rate in uk,0,15,0%,81.07
divorce rates in america,0,15,0%,83.27
divorce advice for men uk,0,14,0%,69.29
rate of divorce in uk,0,14,0%,80.43
divorce coaching jobs,0,14,0%,83.36
divorce rate in united states,0,14,0%,86.79
average age divorce uk,0,14,0%,92.07
divorce rate us,0,13,0%,86.31
divorce rates us over time,0,13,0%,92.15
uk divorce rates over time,0,13,0%,98.15
uk divorce rate 2025,0,12,0%,41.42
support group for breakups,0,12,0%,63.5
what is the divorce rate in uk,0,12,0%,69.33
divorce rate by decade,0,12,0%,82
american divorce rate,0,12,0%,85.33
divorce rates over time,0,12,0%,93.08
divorce rates in england,0,11,0%,77.55
divorce rate in the us,0,11,0%,79.27
divorce rate uk over time,0,11,0%,100.73
united states divorce rate,0,10,0%,72.6
divorce rate in united kingdom,0,10,0%,82.4
usa divorce rate,0,10,0%,85.8
divorce rate america,0,10,0%,87.3
america divorce rate,0,10,0%,88.7
breakup support groups online,0,9,0%,64.44
divorce rates in the uk,0,9,0%,75.56
divorce rate usa,0,9,0%,84.44
divorce rates through the years,0,9,0%,86.33
divorce rates in the united states,0,9,0%,86.44
us divorce statistics,0,9,0%,87.56
divorce rate in america by year,0,9,0%,90.44
u.s. divorce rate by year,0,9,0%,90.56
divorce rates in america over time,0,9,0%,91
statistics on divorce,0,9,0%,94.11
break up coach jobs,0,8,0%,9.88
divorce coach training uk,0,8,0%,40.75
divorce figures uk,0,8,0%,71.38
us divorce rates,0,8,0%,72
what is the uk divorce rate,0,8,0%,81.75
united states divorce rate by year,0,8,0%,82.12
average divorce rate in us,0,8,0%,86.62
divorce rates over the years,0,8,0%,87.88
breakup support group online free,0,7,0%,60.43
divorce rates england,0,7,0%,73
the us divorce rate,0,7,0%,76.43
break up support groups,0,7,0%,77.57
divorce rate history,0,7,0%,85
marriage divorce rate uk,0,7,0%,88
divorce rates in the us,0,7,0%,90.57
divorce statistics united states,0,7,0%,90.86
divorce rate in us over time,0,7,0%,91.71
us divorce rate over time,0,7,0%,94.71
number of divorces in uk,0,7,0%,97.57
average age for divorce uk,0,6,0%,75.5
historical divorce rates,0,6,0%,78.67
break up support group,0,6,0%,81.33
divorce rates in us,0,6,0%,85.83
american divorce rates,0,6,0%,86.67
what is the divorce rate in the united states,0,6,0%,86.83
uk rate of divorce,0,6,0%,88
us divorce rates over time,0,6,0%,88.67
divorce rates in usa,0,6,0%,89
united states divorce statistics,0,6,0%,89.67
divorce rate united states,0,5,0%,65
sara davidson divorce coach,0,5,0%,72
percentage of divorces in uk,0,5,0%,78.2
heartbreak support group,0,5,0%,80.4
average divorce rate in the us,0,5,0%,81.8
rates of divorce uk,0,5,0%,82
what is the divorce rate in united states,0,5,0%,83.8
divorce rate in us percentage,0,5,0%,86.6
american divorce rate by year,0,5,0%,89.4
divorce rate in us by year,0,5,0%,89.8
divorce rates in us by year,0,5,0%,92
uk divorce percentage,0,5,0%,92
divorce rate us over time,0,5,0%,92.6
reasons for divorce uk statistics,0,5,0%,95.8
current uk divorce rate,0,5,0%,97.2
divorce rates america,0,4,0%,73.25
divorce trends in the united states,0,4,0%,74.5
uk divorce rate percentage,0,4,0%,76
divorce rates us,0,4,0%,78.5
sarah davison divorce coach,0,4,0%,81.75
percentage of divorce uk,0,4,0%,82.75
divorce rates in us over time,0,4,0%,83.75
divorce rates uk over time,0,4,0%,85.75
divorce rate of america,0,4,0%,87.25
u.s. divorce rate,0,4,0%,87.75
divorce rates usa,0,4,0%,89
divorce coach rates,0,4,0%,90.5
divorce statistics in america,0,4,0%,92.25
what are the divorce rates in the uk,0,4,0%,93.5
divorce rates uk 2025,0,3,0%,51.33
what is the divorce rate in england,0,3,0%,70.33
support groups for relationship breakups,0,3,0%,75
divorce rates united states,0,3,0%,76.33
the divorce rate in the united states,0,3,0%,79
divorce rate of usa,0,3,0%,83.33
the divorce rate in the us,0,3,0%,84.67
divorce rates in the us by year,0,3,0%,85
divorce rates in united states,0,3,0%,86.67
what is the divorce rate in america,0,3,0%,87.67
divorce help for men,0,3,0%,91
london divorce rate,0,3,0%,92
divorce rates over time usa,0,3,0%,92.33
what is divorce rate in us,0,3,0%,93
divorce statistics usa,0,3,0%,93.33
divorce statistics,0,3,0%,95.33
divorce statistics in us,0,3,0%,96.33
graph of divorce rate in america,0,3,0%,98
#divorcecoaching,0,2,0%,4.5
divorce coach certification canada,0,2,0%,48
divorce coaching training,0,2,0%,56.5
certified divorce coach program,0,2,0%,60
sarah davidson divorce coach,0,2,0%,63
online support groups for breakups,0,2,0%,65
divorce.rate in us,0,2,0%,72
usa divorce rates,0,2,0%,72.5
divorse rate uk,0,2,0%,76
divorce coach qualifications,0,2,0%,78
divorce coaches,0,2,0%,79.5
divorce rate percentage uk,0,2,0%,80
average divorce rate in america,0,2,0%,80.5
divirce rate us,0,2,0%,81.5
divorce rate 2023,0,2,0%,85
what is divorce rate in united states,0,2,0%,86
divorce rate trends,0,2,0%,87
united states divorce rates,0,2,0%,87
what is the divorce rate in the usa,0,2,0%,89.5
what is the divorce rate in us,0,2,0%,90
divorce ratio in usa,0,2,0%,91
what is the divorce rate in usa,0,2,0%,91.5
divorce life coach,0,2,0%,92
divorce rate in the usa,0,2,0%,93.5
divorce rates over the last 50 years,0,2,0%,94
divorce recovery coach,0,2,0%,96.5
are divorce rates increasing,0,2,0%,97.5
divorce rates in america by year,0,2,0%,98
divorce rate over the years,0,2,0%,98.5
rate of divorce in usa,0,2,0%,99.5
how many couples get divorced uk,0,2,0%,100
us rate of divorce,0,2,0%,107
international divorce coach,0,1,0%,7
divorce coach cost,0,1,0%,20
divorce coach training online,0,1,0%,23
divorce recovery coach training,0,1,0%,24
breakup group website,0,1,0%,36
sara davidson divorce,0,1,0%,41
sara davison global enterprises,0,1,0%,47
men's guide to divorce,0,1,0%,60
uk divorce rate 2025 statistics,0,1,0%,61
u s divorce rate,0,1,0%,63
divorce rates in the usa,0,1,0%,66
how to protect yourself as a man in a divorce uk,0,1,0%,70
what is the us divorce rate,0,1,0%,73
what's the us divorce rate,0,1,0%,73
divorce rate by income level,0,1,0%,75
what is the united states divorce rate,0,1,0%,76
english divorce rate,0,1,0%,77
divorce ratio in america,0,1,0%,79
divorce rate by year graph,0,1,0%,80
divorce rate uk 2025,0,1,0%,80
what is the percentage of divorce in the uk,0,1,0%,80
divorce coaching uk,0,1,0%,84
divorce rates 2023,0,1,0%,84
statistics on divorce rates in america,0,1,0%,84
divorce coach for women,0,1,0%,85
statistics divorce uk,0,1,0%,85
uk divorce stats,0,1,0%,85
uk marriage divorce rate,0,1,0%,86
divorce trends,0,1,0%,87
divorce rates by income,0,1,0%,88
divorce stats us,0,1,0%,88
america divorce rates,0,1,0%,89
america's divorce rate,0,1,0%,89
divorce rate in the us by year,0,1,0%,89
divorce rate statistics in america,0,1,0%,89
average american divorce rate,0,1,0%,90
coach divorce,0,1,0%,90
divorce rate 2022,0,1,0%,90
divorce planning for men,0,1,0%,91
divorce rate by year,0,1,0%,92
support groups for breakups online,0,1,0%,92
divorce rate over time usa,0,1,0%,93
what is the rate of divorce in the united states,0,1,0%,93
best divorce advice for men,0,1,0%,94
divorce in usa rate,0,1,0%,94
divorce statistics us,0,1,0%,94
rate of divorce in america,0,1,0%,94
the divorce rate in america,0,1,0%,94
your divorce coach,0,1,0%,95
divorce rate of us,0,1,0%,96
how to start a divorce uk,0,1,0%,96
divorce statistics in the united states,0,1,0%,97
divorces per year in us,0,1,0%,97
divorse rate in us,0,1,0%,97
how common is divorce uk,0,1,0%,97
online breakup support groups,0,1,0%,97
rate of divorce in the us,0,1,0%,97
break up coach latest,0,1,0%,98
what is divorce rate in america,0,1,0%,98
divorce rate us by year,0,1,0%,99
percentage divorce uk,0,1,0%,99
what are the divorce rates in america,0,1,0%,99
uk divorce rate over time,0,1,0%,101
what are the divorce rates in the us,0,1,0%,101
divorce rights for men,0,1,0%,102